{
    "name": "Night of the Zealot",
    "id": "1",
    "icon": "https://cf.geekdo-images.com/original/img/JyAKQ5RxTet7xpBoRd8N2cVPYqM=/0x0/pic3503052.png",
    "arkhamDbEntry": "https://arkhamdb.com/set/core",
    "releaseDate": "2016-11-10",
    "returnTo": false,
    "scenarios": [
        {
            "name": "The Gathering",
            "id": "1-1",
            "icon": "https://cf.geekdo-images.com/original/img/S7eCJwohbbghDADgY7xEp4fB9VY=/0x0/pic3503053.png",
            "encounterSets": [
                { "name": "The Gathering", "conditional": false, "setAside": false },
                { "name": "Rats",          "conditional": false, "setAside": false },
                { "name": "Ghouls",        "conditional": false, "setAside": false },
                { "name": "Striking Fear", "conditional": false, "setAside": false },
                { "name": "Ancient Evils", "conditional": false, "setAside": false },
                { "name": "Chilling Cold", "conditional": false, "setAside": false }
            ]
        },
        {
            "name": "The Midnight Masks",
            "id": "1-2",
            "icon": "https://cf.geekdo-images.com/original/img/h0XcCJQpTEgW4XxetASpjLzcR9A=/0x0/pic3503054.png",
            "encounterSets": [
                { "name": "The Midnight Masks", "conditional": false, "setAside": false },
                { "name": "Chilling Cold",      "conditional": false, "setAside": false },
                { "name": "Dark Cult",          "conditional": false, "setAside": false },
                { "name": "Nightgaunts",        "conditional": false, "setAside": false },
                { "name": "Locked Doors",       "conditional": false, "setAside": false },
                { "name": "Cult of Umôrdhoth",  "conditional": false, "setAside": true  }
            ]
        },
        {
            "name": "The Devourer Below",
            "id": "1-3",
            "icon": "https://cf.geekdo-images.com/original/img/qFXZpOLtp7sntHY-FQIK8nZgMdo=/0x0/pic3503056.png",
            "encounterSets": [
                { "name": "The Devourer Below",       "conditional": false, "setAside": false },
                { "name": "Ghouls",                   "conditional": false, "setAside": false },
                { "name": "Striking Fear",            "conditional": false, "setAside": false },
                { "name": "Ancient Evils",            "conditional": false, "setAside": false },
                { "name": "Dark Cult",                "conditional": false, "setAside": false },
                { "name": "Agents of Hastur",         "conditional": true,  "setAside": false  },
                { "name": "Agents of Yog-Sothoth",    "conditional": true,  "setAside": false  },
                { "name": "Agents of Shub Niggurath", "conditional": true,  "setAside": false  },
                { "name": "Agenths of Cthulhu",       "conditional": true,  "setAside": false  }
            ]
        }
    ],
    "encounterSets": [
        {
            "name": "The Gathering",
            "icon": "https://cf.geekdo-images.com/original/img/S7eCJwohbbghDADgY7xEp4fB9VY=/0x0/pic3503053.png",
            "arkhamDbEntry": "https://arkhamdb.com/find?q=m:torch"
        },
        {
            "name": "The Midnight Masks",
            "icon": "https://cf.geekdo-images.com/original/img/h0XcCJQpTEgW4XxetASpjLzcR9A=/0x0/pic3503054.png",
            "arkhamDbEntry": "https://arkhamdb.com/find?q=m:arkham"
        },
        {
            "name": "The Devourer Below",
            "icon": "https://cf.geekdo-images.com/original/img/qFXZpOLtp7sntHY-FQIK8nZgMdo=/0x0/pic3503056.png",
            "arkhamDbEntry": "https://arkhamdb.com/find?q=m:tentacles"
        },
        {
            "name": "Cult of Umôrdhoth",
            "icon": "https://cf.geekdo-images.com/original/img/EJ3nMieXgX6mac0e2gmJ5e5_EGQ=/0x0/pic3503055.png",
            "arkhamDbEntry": "https://arkhamdb.com/find?q=m:cultists"
        },
        {
            "name": "Rats",
            "icon": "https://cf.geekdo-images.com/original/img/IOV2zK1AyoMatAVZCkV6FnVGhHI=/0x0/pic3503057.png",
            "arkhamDbEntry": "https://arkhamdb.com/find?q=m:rats"
        },
        {
            "name": "Ghouls",
            "icon": "https://cf.geekdo-images.com/original/img/r8TvQfIdLrv_oJs01keCRhy0a4k=/0x0/pic3503058.png",
            "arkhamDbEntry": "https://arkhamdb.com/find?q=m:ghouls"
        },
        {
            "name": "Striking Fear",
            "icon": "https://cf.geekdo-images.com/original/img/IjvxebRfBLUOLgp5FCehn-yaDNI=/0x0/pic3503059.png",
            "arkhamDbEntry": "https://arkhamdb.com/find?q=m:striking_fear"
        },
        {
            "name": "Ancient Evils",
            "icon": "https://cf.geekdo-images.com/original/img/tr1MnYB7Mn1hg67vj8qR-Y3IfOY=/0x0/pic3503060.png",
            "arkhamDbEntry": "https://arkhamdb.com/find?q=m:ancient_evils"
        },
        {
            "name": "Chilling Cold",
            "icon": "https://cf.geekdo-images.com/original/img/F2hVLsiWE3SU4lOMFBat0Pdm5cw=/0x0/pic3503061.png",
            "arkhamDbEntry": "https://arkhamdb.com/find?q=m:chilling_cold"
        },
        {
            "name": "Dark Cult",
            "icon": "https://cf.geekdo-images.com/original/img/yxfb_pYx5nE21jpIDrZYbH_oowA=/0x0/pic3503062.png",
            "arkhamDbEntry": "https://arkhamdb.com/find?q=m:pentagram"
        },
        {
            "name": "Nightgaunts",
            "icon": "https://cf.geekdo-images.com/original/img/qKmpsv1-y0MX0nZ_MLNvYPlJuK4=/0x0/pic3503063.png",
            "arkhamDbEntry": "https://arkhamdb.com/find?q=m:nightgaunts"
        },
        {
            "name": "Locked Doors",
            "icon": "https://cf.geekdo-images.com/original/img/Yx73-MvMIFh8ARI-SJ1m80oMfAg=/0x0/pic3503064.png",
            "arkhamDbEntry": "https://arkhamdb.com/find?q=m:locked_doors"
        },
        {
            "name": "Agents of Hastur",
            "icon": "https://cf.geekdo-images.com/original/img/FFp7lhe66LMTX3DS4OAWzgQxj1Q=/0x0/pic3503065.png",
            "arkhamDbEntry": "https://arkhamdb.com/find?q=m:agents_of_hastur"
        },
        {
            "name": "Agents of Yog-Sothoth",
            "icon": "https://cf.geekdo-images.com/original/img/zAaCKQJzDbm6Y1TfVlvLGjYI29E=/0x0/pic3503066.png",
            "arkhamDbEntry": "https://arkhamdb.com/find?q=m:agents_of_yog"
        },
        {
            "name": "Agents of Shub Niggurath",
            "icon": "https://cf.geekdo-images.com/original/img/RxELtyAqIZX5huwUrlfiC95Onuk=/0x0/pic3503067.png",
            "arkhamDbEntry": "https://arkhamdb.com/find?q=m:agents_of_shub"
        },
        {
            "name": "Agenths of Cthulhu",
            "icon": "https://cf.geekdo-images.com/original/img/ecRtSQBkwnnG8SHRVU0gYYetcu0=/0x0/pic3503068.png",
            "arkhamDbEntry": "https://arkhamdb.com/find?q=m:agents_of_cthulhu"
        }
    ],
    "investigators": [
        {
            "name": "Roland Banks",
            "mainClass": "Guardian",
            "arkhamDbEntry": "https://arkhamdb.com/card/01001"
        },
        {
            "name": "Daisy Walker",
            "mainClass": "Seeker",
            "arkhamDbEntry": "https://arkhamdb.com/card/01002"
        },
        {
            "name": "\"Skids\" O-Toole",
            "mainClass": "Rogue",
            "arkhamDbEntry": "https://arkhamdb.com/card/01003"
        },
        {
            "name": "Agnes Baker",
            "mainClass": "Mystic",
            "arkhamDbEntry": "https://arkhamdb.com/card/01004"
        },
        {
            "name": "Wendy Adams",
            "mainClass": "Survivor",
            "arkhamDbEntry": "https://arkhamdb.com/card/01005"
        }
    ]
}
